{
    "version": "1.0.2",
    "minEngineVersion": "4.6.0",
    "maxEngineVersion": null,
    "installerUrl": "https://github.com/gibson9583/engine-thread-viewer/releases/download/v1.0.2/thread-viewer-1.0.2.zip",
    "sha256": "c40af9c6d5ca3dfaf0ef17c94e75ce38440dba768a6f54e34162f5fc198f31bd",
    "restartRequired": true,
    "releaseNotesUrl": "https://github.com/gibson9583/engine-thread-viewer/releases/tag/v1.0.2",
    "docsUrl": "https://raw.githubusercontent.com/gibson9583/engine-thread-viewer/main/docs/store.md"
}