{
    "version": "1.0.8",
    "minEngineVersion": "4.6.0",
    "maxEngineVersion": "4.7.0",
    "installerUrl": "https://github.com/gibson9583/engine-thread-viewer/releases/download/v1.0.8/thread-viewer-1.0.8.zip",
    "sha256": "2e8b446e765c3b90157aac0d560389309c8d2c37ca2bf9615e600d5b5e8816eb",
    "restartRequired": true,
    "publishedAt": "2026-10-20T17:35:38Z",
    "releaseNotesUrl": "https://github.com/gibson9583/engine-thread-viewer/releases/tag/v1.0.8",
    "docsUrl": "https://raw.githubusercontent.com/gibson9583/engine-thread-viewer/v1.0.8/docs/store.md"
}
