{
    "version": "0.0.1",
    "minEngineVersion": "4.5.2",
    "maxEngineVersion": null,
    "installerUrl": "https://github.com/gibson9583/oie-web-support-plugin/releases/download/v0.0.1/websupport-0.0.1.zip",
    "sha256": "1595680e3e8204571e8fd654163a0469455464594223c0c9267e64b47927c6cf",
    "restartRequired": true,
    "publishedAt": "2026-07-11T18:52:41Z",
    "releaseNotesUrl": "https://github.com/gibson9583/oie-web-support-plugin/releases/tag/v0.0.1",
    "docsUrl": "https://raw.githubusercontent.com/gibson9583/oie-web-support-plugin/v0.0.1/docs/store.md"
}
